{
  "$schema": "https://json-schema.org/draft/2020-12/schema",
  "$id": "urn:mullusi:schema:capability-descriptor:1",
  "title": "Capability Descriptor",
  "type": "object",
  "additionalProperties": false,
  "required": [
    "capability_id",
    "subject_id",
    "name",
    "version",
    "scope",
    "constraints"
  ],
  "properties": {
    "capability_id": {
      "type": "string",
      "minLength": 1
    },
    "subject_id": {
      "type": "string",
      "minLength": 1
    },
    "name": {
      "type": "string",
      "minLength": 1
    },
    "version": {
      "type": "string",
      "minLength": 1
    },
    "scope": {
      "type": "string",
      "minLength": 1
    },
    "constraints": {
      "type": "array",
      "minItems": 1,
      "items": {
        "type": "string",
        "minLength": 1
      }
    },
    "metadata": {
      "type": "object",
      "additionalProperties": true
    },
    "extensions": {
      "type": "object",
      "additionalProperties": true
    }
  }
}
